{
  "schemaVersion": "2.0.0",
  "level": "유치원",
  "title": "Music in a Dark Room",
  "chapterTitles": [
    "Friday Practice",
    "A Dark Classroom",
    "Music from Simple Things",
    "Practice at Home",
    "The Saturday Show",
    "A New School Club"
  ],
  "isManual": true,
  "coverage": {
    "mustCoverAll": false,
    "allowUpperLevelWords": false,
    "coverageRate": 0.156
  },
  "usedWords": [
    {
      "lemma": "by",
      "partOfSpeech": "preposition",
      "forms": [
        "by"
      ]
    },
    {
      "lemma": "can",
      "partOfSpeech": "verb",
      "forms": [
        "could"
      ]
    },
    {
      "lemma": "would",
      "partOfSpeech": "verb",
      "forms": [
        "would"
      ]
    },
    {
      "lemma": "about",
      "partOfSpeech": "preposition",
      "forms": [
        "about"
      ]
    },
    {
      "lemma": "one",
      "partOfSpeech": "numeral",
      "forms": [
        "one"
      ]
    },
    {
      "lemma": "think",
      "partOfSpeech": "verb",
      "forms": [
        "think"
      ]
    },
    {
      "lemma": "them",
      "partOfSpeech": "pronoun",
      "forms": [
        "them"
      ]
    },
    {
      "lemma": "him",
      "partOfSpeech": "pronoun",
      "forms": [
        "him"
      ]
    },
    {
      "lemma": "two",
      "partOfSpeech": "numeral",
      "forms": [
        "two"
      ]
    },
    {
      "lemma": "want",
      "partOfSpeech": "verb",
      "forms": [
        "wanted"
      ]
    },
    {
      "lemma": "because",
      "partOfSpeech": "conjunction",
      "forms": [
        "because"
      ]
    },
    {
      "lemma": "use",
      "partOfSpeech": "verb",
      "forms": [
        "use"
      ]
    },
    {
      "lemma": "man",
      "partOfSpeech": "noun",
      "forms": [
        "man"
      ]
    },
    {
      "lemma": "thing",
      "partOfSpeech": "noun",
      "forms": [
        "things"
      ]
    },
    {
      "lemma": "only",
      "partOfSpeech": "adverb",
      "forms": [
        "only"
      ]
    },
    {
      "lemma": "tell",
      "partOfSpeech": "verb",
      "forms": [
        "told"
      ]
    },
    {
      "lemma": "back",
      "partOfSpeech": "adverb",
      "forms": [
        "back"
      ]
    },
    {
      "lemma": "through",
      "partOfSpeech": "preposition",
      "forms": [
        "through"
      ]
    },
    {
      "lemma": "work",
      "partOfSpeech": "verb",
      "forms": [
        "work"
      ]
    },
    {
      "lemma": "down",
      "partOfSpeech": "adverb",
      "forms": [
        "down"
      ]
    },
    {
      "lemma": "school",
      "partOfSpeech": "noun",
      "forms": [
        "school"
      ]
    },
    {
      "lemma": "too",
      "partOfSpeech": "adverb",
      "forms": [
        "too"
      ]
    },
    {
      "lemma": "three",
      "partOfSpeech": "numeral",
      "forms": [
        "three"
      ]
    },
    {
      "lemma": "turn",
      "partOfSpeech": "verb",
      "forms": [
        "turned"
      ]
    },
    {
      "lemma": "problem",
      "partOfSpeech": "noun",
      "forms": [
        "problem"
      ]
    },
    {
      "lemma": "show",
      "partOfSpeech": "verb",
      "forms": [
        "show"
      ]
    },
    {
      "lemma": "place",
      "partOfSpeech": "noun",
      "forms": [
        "place"
      ]
    },
    {
      "lemma": "again",
      "partOfSpeech": "adverb",
      "forms": [
        "again"
      ]
    },
    {
      "lemma": "right",
      "partOfSpeech": "adverb",
      "forms": [
        "right"
      ]
    },
    {
      "lemma": "large",
      "partOfSpeech": "adjective",
      "forms": [
        "large"
      ]
    },
    {
      "lemma": "home",
      "partOfSpeech": "noun",
      "forms": [
        "home"
      ]
    },
    {
      "lemma": "head",
      "partOfSpeech": "verb",
      "forms": [
        "headed"
      ]
    },
    {
      "lemma": "set",
      "partOfSpeech": "verb",
      "forms": [
        "set"
      ]
    },
    {
      "lemma": "later",
      "partOfSpeech": "adverb",
      "forms": [
        "later"
      ]
    },
    {
      "lemma": "team",
      "partOfSpeech": "noun",
      "forms": [
        "team"
      ]
    },
    {
      "lemma": "idea",
      "partOfSpeech": "noun",
      "forms": [
        "ideas"
      ]
    },
    {
      "lemma": "watch",
      "partOfSpeech": "verb",
      "forms": [
        "watched"
      ]
    },
    {
      "lemma": "stop",
      "partOfSpeech": "verb",
      "forms": [
        "stop"
      ]
    },
    {
      "lemma": "food",
      "partOfSpeech": "noun",
      "forms": [
        "food"
      ]
    },
    {
      "lemma": "music",
      "partOfSpeech": "noun",
      "forms": [
        "music"
      ]
    },
    {
      "lemma": "stay",
      "partOfSpeech": "verb",
      "forms": [
        "stayed"
      ]
    },
    {
      "lemma": "late",
      "partOfSpeech": "adjective",
      "forms": [
        "late"
      ]
    },
    {
      "lemma": "better",
      "partOfSpeech": "adjective",
      "forms": [
        "better"
      ]
    },
    {
      "lemma": "up",
      "partOfSpeech": "preposition",
      "forms": [
        "up"
      ]
    },
    {
      "lemma": "test",
      "partOfSpeech": "verb",
      "forms": [
        "tested"
      ]
    },
    {
      "lemma": "top",
      "partOfSpeech": "noun",
      "forms": [
        "top"
      ]
    },
    {
      "lemma": "order",
      "partOfSpeech": "noun",
      "forms": [
        "order"
      ]
    },
    {
      "lemma": "note",
      "partOfSpeech": "verb",
      "forms": [
        "note"
      ]
    },
    {
      "lemma": "answer",
      "partOfSpeech": "noun",
      "forms": [
        "answer"
      ]
    },
    {
      "lemma": "message",
      "partOfSpeech": "noun",
      "forms": [
        "message"
      ]
    },
    {
      "lemma": "memory",
      "partOfSpeech": "noun",
      "forms": [
        "memory"
      ]
    },
    {
      "lemma": "evening",
      "partOfSpeech": "noun",
      "forms": [
        "evening"
      ]
    },
    {
      "lemma": "machine",
      "partOfSpeech": "noun",
      "forms": [
        "machine"
      ]
    },
    {
      "lemma": "step",
      "partOfSpeech": "verb",
      "forms": [
        "step"
      ]
    },
    {
      "lemma": "video",
      "partOfSpeech": "noun",
      "forms": [
        "video"
      ]
    },
    {
      "lemma": "sun",
      "partOfSpeech": "noun",
      "forms": [
        "sun"
      ]
    },
    {
      "lemma": "club",
      "partOfSpeech": "noun",
      "forms": [
        "club"
      ]
    },
    {
      "lemma": "band",
      "partOfSpeech": "verb",
      "forms": [
        "banded"
      ]
    },
    {
      "lemma": "move",
      "partOfSpeech": "noun",
      "forms": [
        "move"
      ]
    },
    {
      "lemma": "smile",
      "partOfSpeech": "verb",
      "forms": [
        "smiled"
      ]
    },
    {
      "lemma": "surprise",
      "partOfSpeech": "verb",
      "forms": [
        "surprising"
      ]
    },
    {
      "lemma": "stand",
      "partOfSpeech": "noun",
      "forms": [
        "stand"
      ]
    },
    {
      "lemma": "touch",
      "partOfSpeech": "verb",
      "forms": [
        "touched"
      ]
    },
    {
      "lemma": "match",
      "partOfSpeech": "noun",
      "forms": [
        "match"
      ]
    },
    {
      "lemma": "drum",
      "partOfSpeech": "noun",
      "forms": [
        "drum"
      ]
    },
    {
      "lemma": "an",
      "partOfSpeech": "determiner",
      "forms": [
        "an"
      ]
    },
    {
      "lemma": "friday",
      "partOfSpeech": "noun",
      "forms": [
        "friday"
      ]
    },
    {
      "lemma": "monday",
      "partOfSpeech": "noun",
      "forms": [
        "monday"
      ]
    },
    {
      "lemma": "same",
      "partOfSpeech": "adjective",
      "forms": [
        "same"
      ]
    },
    {
      "lemma": "saturday",
      "partOfSpeech": "noun",
      "forms": [
        "saturday"
      ]
    },
    {
      "lemma": "saw",
      "partOfSpeech": "noun",
      "forms": [
        "saw"
      ]
    },
    {
      "lemma": "some",
      "partOfSpeech": "determiner",
      "forms": [
        "some"
      ]
    },
    {
      "lemma": "even",
      "partOfSpeech": "adverb",
      "forms": [
        "even"
      ]
    },
    {
      "lemma": "still",
      "partOfSpeech": "adverb",
      "forms": [
        "still"
      ]
    },
    {
      "lemma": "part",
      "partOfSpeech": "noun",
      "forms": [
        "part"
      ]
    },
    {
      "lemma": "during",
      "partOfSpeech": "preposition",
      "forms": [
        "during"
      ]
    },
    {
      "lemma": "power",
      "partOfSpeech": "noun",
      "forms": [
        "power"
      ]
    },
    {
      "lemma": "around",
      "partOfSpeech": "adverb",
      "forms": [
        "around"
      ]
    }
  ],
  "usedPhrasalVerbs": [
    {
      "id": "phrasal-hold-to",
      "phrasalVerb": "hold to",
      "storyForm": "held to",
      "context": "The children held to one good rule: the children had to listen.",
      "senseId": "cce5baa618c3a64a1498a5ce5321fc4d591a607aef00e22214eca675e293f7e9",
      "meaningKo": "특정한 믿음이나 기준을 계속 지키다"
    },
    {
      "id": "phrasal-stand-back",
      "phrasalVerb": "stand back",
      "storyForm": "stand back",
      "context": "Sara asked them to stand back from the problem and hear the full music.",
      "senseId": "7eae5d41bf547f9dea74ff2505f4d7e751ba2185589ac1c783b9eb640c1b45d1",
      "meaningKo": "감정과 거리를 두고 상황을 객관적으로 보다"
    },
    {
      "id": "phrasal-meet-with",
      "phrasalVerb": "meet with",
      "storyForm": "met with",
      "context": "Ms Park met with the team at a round table.",
      "senseId": "5627a9d913b510518dc53a4d2f51c41225fc62da9c6a396943224074af91acf8",
      "meaningKo": "누군가와 공식적인 회의를 하다"
    },
    {
      "id": "phrasal-open-out",
      "phrasalVerb": "open out",
      "storyForm": "opened out",